{
  "$schema": "https://json-schema.org/draft/2020-12/schema",
  "$id": "https://viz-site.dev/schemas/dashboard.schema.json",
  "title": "Dashboard",
  "type": "object",
  "additionalProperties": false,
  "required": ["schema_version", "id", "title", "layout"],
  "properties": {
    "schema_version": {"const": 1},
    "id": {"type": "string", "maxLength": 512, "pattern": "^[a-z0-9]+(-[a-z0-9]+)*(/[a-z0-9]+(-[a-z0-9]+)*)*$"},
    "title": {"type": "string", "minLength": 1, "maxLength": 200},
    "description": {"type": "string", "maxLength": 8192},
    "tags": {"type": "array", "maxItems": 32, "items": {"type": "string", "minLength": 1, "maxLength": 64}},
    "author": {"type": "string", "maxLength": 200},
    "created_at": {"type": "string", "format": "date-time"},
    "updated_at": {"type": "string", "format": "date-time"},
    "controls": {
      "type": "array",
      "maxItems": 20,
      "items": {
        "oneOf": [
          {"$ref": "#/$defs/dateRange"},
          {"$ref": "#/$defs/select"},
          {"$ref": "#/$defs/numberRange"}
        ]
      }
    },
    "layout": {
      "type": "array",
      "minItems": 1,
      "maxItems": 100,
      "items": {"oneOf": [{"$ref": "#/$defs/chartTile"}, {"$ref": "#/$defs/markdownTile"}]}
    }
  },
  "$defs": {
    "slug": {"type": "string", "maxLength": 64, "pattern": "^[a-z0-9]+(-[a-z0-9]+)*$"},
    "columnName": {"type": "string", "pattern": "^[A-Za-z_][A-Za-z0-9_]*$"},
    "controlBase": {
      "type": "object",
      "required": ["id", "type", "label", "column"],
      "properties": {
        "id": {"$ref": "#/$defs/slug"},
        "label": {"type": "string", "minLength": 1, "maxLength": 80},
        "column": {"$ref": "#/$defs/columnName"}
      }
    },
    "dateRange": {
      "allOf": [{"$ref": "#/$defs/controlBase"}],
      "properties": {
        "id": true, "label": true, "column": true,
        "type": {"const": "date-range"},
        "default": {
          "oneOf": [
            {"type": "null"},
            {"type": "object", "additionalProperties": false, "required": ["last"], "properties": {"last": {"type": "string", "pattern": "^[0-9]{1,3}[dwmy]$"}}},
            {"type": "object", "additionalProperties": false, "required": ["from", "to"], "properties": {"from": {"type": "string", "format": "date"}, "to": {"type": "string", "format": "date"}}}
          ]
        }
      },
      "additionalProperties": false
    },
    "select": {
      "allOf": [{"$ref": "#/$defs/controlBase"}],
      "properties": {
        "id": true, "label": true, "column": true,
        "type": {"const": "select"},
        "multi": {"type": "boolean"},
        "default": {
          "oneOf": [
            {"type": "null"},
            {"type": "string", "maxLength": 200},
            {"type": "array", "maxItems": 100, "items": {"type": "string", "maxLength": 200}}
          ]
        }
      },
      "additionalProperties": false
    },
    "numberRange": {
      "allOf": [{"$ref": "#/$defs/controlBase"}],
      "properties": {
        "id": true, "label": true, "column": true,
        "type": {"const": "number-range"},
        "default": {
          "oneOf": [
            {"type": "null"},
            {"type": "object", "additionalProperties": false, "properties": {"min": {"type": "number"}, "max": {"type": "number"}}}
          ]
        }
      },
      "additionalProperties": false
    },
    "chartTile": {
      "type": "object",
      "additionalProperties": false,
      "required": ["chart", "w", "h"],
      "properties": {
        "chart": {"type": "string", "maxLength": 512, "pattern": "^[a-z0-9]+(-[a-z0-9]+)*(/[a-z0-9]+(-[a-z0-9]+)*)*$"},
        "w": {"type": "integer", "minimum": 1, "maximum": 12},
        "h": {"type": "integer", "minimum": 1, "maximum": 12}
      }
    },
    "markdownTile": {
      "type": "object",
      "additionalProperties": false,
      "required": ["markdown", "w", "h"],
      "properties": {
        "markdown": {"type": "string", "maxLength": 8192},
        "w": {"type": "integer", "minimum": 1, "maximum": 12},
        "h": {"type": "integer", "minimum": 1, "maximum": 12}
      }
    }
  }
}
