{
  "schema_version": 1,
  "id": "sales/overview",
  "title": "Sales overview",
  "description": "Revenue and orders by region.",
  "tags": ["sales"],
  "author": "sample@example.com",
  "created_at": "2026-09-22T10:00:00Z",
  "updated_at": "2026-09-22T10:00:00Z",
  "controls": [
    {"id": "period", "type": "date-range", "label": "Period", "column": "month", "default": {"last": "12m"}},
    {"id": "region", "type": "select", "label": "Region", "column": "region", "multi": true, "default": null},
    {"id": "revenue", "type": "number-range", "label": "Revenue", "column": "revenue", "default": null}
  ],
  "layout": [
    {"chart": "sales/revenue-by-region", "w": 8, "h": 4},
    {"chart": "sales/total-revenue", "w": 4, "h": 2},
    {"markdown": "Sample data, generated deterministically.", "w": 12, "h": 1}
  ]
}
